[32m[I 2026-06-04 13:25:12,782][0m Trial 17 finished with values: [0.05957446808510638, 822992432.0] and parameters: {'num_conv_layers': 4, 'out_channels_layer_0': 32, 'out_channels_layer_1': 128, 'out_channels_layer_2': 8, 'out_channels_layer_3': 32, 'kernel_size': 3, 'stride_conv': 1, 'padding_conv': 3, 'dilatation': 2, 'kernel_stride_pool': 5, 'activation_function_conv': 'leaky_relu', 'use_dropout_conv': False, 'use_normalization_conv': True, 'num_fc_layers': 2, 'fc_units_0': 128, 'fc_units_1': 64, 'activation_function_fc': 'sigmoid', 'use_dropout_fc': True, 'dropout_rate_fc': 0.2, 'use_normalization_fc': False, 'batch_size': 16, 'learning_rate': 0.09961719473204968, 'optimizer': 'adam', 'use_weight_decay': False, 'use_betas': False}.[0m

  → Modelo salvo: optuna_studies/models/trial_17_model.pth

Unsupported operator aten::feature_dropout encountered 3 time(s)

Unsupported operator aten::max_pool2d encountered 3 time(s)

Unsupported operator aten::sigmoid encountered 1 time(s)

[32m[I 2026-06-04 14:42:44,702][0m Trial 18 finished with values: [0.4281729742664643, 494140152.0] and parameters: {'num_conv_layers': 3, 'out_channels_layer_0': 64, 'out_channels_layer_1': 16, 'out_channels_layer_2': 32, 'kernel_size': 5, 'stride_conv': 2, 'padding_conv': 1, 'dilatation': 3, 'kernel_stride_pool': 2, 'activation_function_conv': 'relu', 'use_dropout_conv': True, 'dropout_rate_conv': 0.6, 'use_normalization_conv': False, 'num_fc_layers': 1, 'fc_units_0': 8, 'activation_function_fc': 'sigmoid', 'use_dropout_fc': True, 'dropout_rate_fc': 0.6, 'use_normalization_fc': True, 'batch_size': 32, 'learning_rate': 0.010929110202465071, 'optimizer': 'sgd', 'use_weight_decay': True, 'weight_decay': 1.769608804072056e-05, 'use_momentum': False}.[0m

[32m[I 2026-06-04 14:42:44,853][0m Trial 19 finished with values: [0.0, inf] and parameters: {'num_conv_layers': 4, 'out_channels_layer_0': 16, 'out_channels_layer_1': 8, 'out_channels_layer_2': 16, 'out_channels_layer_3': 128, 'kernel_size': 3, 'stride_conv': 2, 'padding_conv': 2, 'dilatation': 3, 'kernel_stride_pool': 5, 'activation_function_conv': 'leaky_relu', 'use_dropout_conv': False, 'use_normalization_conv': True, 'num_fc_layers': 3, 'fc_units_0': 256, 'fc_units_1': 128, 'fc_units_2': 256, 'activation_function_fc': 'tanh', 'use_dropout_fc': True, 'dropout_rate_fc': 0.5, 'use_normalization_fc': True, 'batch_size': 32, 'learning_rate': 0.300719673003632, 'optimizer': 'sgd', 'use_weight_decay': False}.[0m

  → Modelo salvo: optuna_studies/models/trial_18_model.pth

[32m[I 2026-06-04 14:42:45,007][0m Trial 20 finished with values: [0.0, inf] and parameters: {'num_conv_layers': 7, 'out_channels_layer_0': 128, 'out_channels_layer_1': 64, 'out_channels_layer_2': 128, 'out_channels_layer_3': 64, 'out_channels_layer_4': 8, 'out_channels_layer_5': 8, 'out_channels_layer_6': 64, 'kernel_size': 4, 'stride_conv': 1, 'padding_conv': 4, 'dilatation': 2, 'kernel_stride_pool': 3, 'activation_function_conv': 'leaky_relu', 'use_dropout_conv': False, 'use_normalization_conv': True, 'num_fc_layers': 2, 'fc_units_0': 32, 'fc_units_1': 32, 'activation_function_fc': 'leaky_relu', 'use_dropout_fc': False, 'use_normalization_fc': False, 'batch_size': 16, 'learning_rate': 0.05624546763999599, 'optimizer': 'rmsprop', 'use_weight_decay': False}.[0m

Unsupported operator aten::leaky_relu encountered 3 time(s)

Unsupported operator aten::max_pool2d encountered 3 time(s)

Unsupported operator aten::sigmoid encountered 1 time(s)

[32m[I 2026-06-04 15:12:17,067][0m Trial 21 finished with values: [0.9057461733243622, 94285592.0] and parameters: {'num_conv_layers': 3, 'out_channels_layer_0': 32, 'out_channels_layer_1': 64, 'out_channels_layer_2': 8, 'kernel_size': 3, 'stride_conv': 2, 'padding_conv': 4, 'dilatation': 3, 'kernel_stride_pool': 5, 'activation_function_conv': 'leaky_relu', 'use_dropout_conv': False, 'use_normalization_conv': True, 'num_fc_layers': 1, 'fc_units_0': 8, 'activation_function_fc': 'sigmoid', 'use_dropout_fc': True, 'dropout_rate_fc': 0.4, 'use_normalization_fc': True, 'batch_size': 32, 'learning_rate': 0.033640719320439334, 'optimizer': 'sgd', 'use_weight_decay': False, 'use_momentum': False}.[0m

  → Modelo salvo: optuna_studies/models/trial_21_model.pth

Unsupported operator aten::leaky_relu encountered 3 time(s)

Unsupported operator aten::max_pool2d encountered 3 time(s)

Unsupported operator aten::sigmoid encountered 1 time(s)

[32m[I 2026-06-04 15:45:35,843][0m Trial 22 finished with values: [0.8980923146292344, 94285592.0] and parameters: {'num_conv_layers': 3, 'out_channels_layer_0': 32, 'out_channels_layer_1': 64, 'out_channels_layer_2': 8, 'kernel_size': 3, 'stride_conv': 2, 'padding_conv': 4, 'dilatation': 3, 'kernel_stride_pool': 5, 'activation_function_conv': 'leaky_relu', 'use_dropout_conv': False, 'use_normalization_conv': True, 'num_fc_layers': 1, 'fc_units_0': 8, 'activation_function_fc': 'sigmoid', 'use_dropout_fc': True, 'dropout_rate_fc': 0.4, 'use_normalization_fc': True, 'batch_size': 32, 'learning_rate': 0.012357811643393933, 'optimizer': 'sgd', 'use_weight_decay': False, 'use_momentum': False}.[0m

  → Modelo salvo: optuna_studies/models/trial_22_model.pth

Unsupported operator aten::feature_dropout encountered 4 time(s)

Unsupported operator aten::max_pool2d encountered 4 time(s)

[32m[I 2026-06-04 16:28:15,700][0m Trial 23 finished with values: [0.731086125893561, 102969112.0] and parameters: {'num_conv_layers': 4, 'out_channels_layer_0': 32, 'out_channels_layer_1': 64, 'out_channels_layer_2': 8, 'out_channels_layer_3': 16, 'kernel_size': 3, 'stride_conv': 2, 'padding_conv': 4, 'dilatation': 1, 'kernel_stride_pool': 4, 'activation_function_conv': 'relu', 'use_dropout_conv': True, 'dropout_rate_conv': 0.2, 'use_normalization_conv': False, 'num_fc_layers': 1, 'fc_units_0': 8, 'activation_function_fc': 'relu', 'use_dropout_fc': True, 'dropout_rate_fc': 0.4, 'use_normalization_fc': True, 'batch_size': 32, 'learning_rate': 0.014283126330025849, 'optimizer': 'adam', 'use_weight_decay': True, 'weight_decay': 0.0009078125150567913, 'use_betas': True, 'beta1': 0.9897898579944826, 'beta2': 0.9972253273189856}.[0m

[32m[I 2026-06-04 16:28:15,850][0m Trial 24 finished with values: [0.0, inf] and parameters: {'num_conv_layers': 3, 'out_channels_layer_0': 32, 'out_channels_layer_1': 32, 'out_channels_layer_2': 8, 'kernel_size': 3, 'stride_conv': 2, 'padding_conv': 0, 'dilatation': 3, 'kernel_stride_pool': 5, 'activation_function_conv': 'leaky_relu', 'use_dropout_conv': False, 'use_normalization_conv': True, 'num_fc_layers': 1, 'fc_units_0': 8, 'activation_function_fc': 'sigmoid', 'use_dropout_fc': True, 'dropout_rate_fc': 0.4, 'use_normalization_fc': True, 'batch_size': 32, 'learning_rate': 0.0020834995116115825, 'optimizer': 'sgd', 'use_weight_decay': False}.[0m

  → Modelo salvo: optuna_studies/models/trial_23_model.pth

[32m[I 2026-06-04 16:28:16,029][0m Trial 25 finished with values: [0.0, inf] and parameters: {'num_conv_layers': 7, 'out_channels_layer_0': 64, 'out_channels_layer_1': 128, 'out_channels_layer_2': 32, 'out_channels_layer_3': 8, 'out_channels_layer_4': 64, 'out_channels_layer_5': 128, 'out_channels_layer_6': 16, 'kernel_size': 3, 'stride_conv': 1, 'padding_conv': 3, 'dilatation': 3, 'kernel_stride_pool': 5, 'activation_function_conv': 'leaky_relu', 'use_dropout_conv': False, 'use_normalization_conv': True, 'num_fc_layers': 1, 'fc_units_0': 8, 'activation_function_fc': 'sigmoid', 'use_dropout_fc': False, 'use_normalization_fc': False, 'batch_size': 16, 'learning_rate': 0.15730290260006327, 'optimizer': 'sgd', 'use_weight_decay': False}.[0m

[32m[I 2026-06-04 16:28:16,217][0m Trial 26 finished with values: [0.0, inf] and parameters: {'num_conv_layers': 4, 'out_channels_layer_0': 16, 'out_channels_layer_1': 16, 'out_channels_layer_2': 16, 'out_channels_layer_3': 32, 'kernel_size': 4, 'stride_conv': 2, 'padding_conv': 1, 'dilatation': 2, 'kernel_stride_pool': 2, 'activation_function_conv': 'tanh', 'use_dropout_conv': True, 'dropout_rate_conv': 0.4, 'use_normalization_conv': False, 'num_fc_layers': 1, 'fc_units_0': 8, 'activation_function_fc': 'sigmoid', 'use_dropout_fc': True, 'dropout_rate_fc': 0.4, 'use_normalization_fc': True, 'batch_size': 32, 'learning_rate': 0.02556329444051099, 'optimizer': 'adam', 'use_weight_decay': True, 'weight_decay': 6.329702795231968e-06}.[0m

[32m[I 2026-06-04 16:28:16,380][0m Trial 27 finished with values: [0.0, inf] and parameters: {'num_conv_layers': 5, 'out_channels_layer_0': 128, 'out_channels_layer_1': 8, 'out_channels_layer_2': 128, 'out_channels_layer_3': 16, 'out_channels_layer_4': 32, 'kernel_size': 3, 'stride_conv': 2, 'padding_conv': 2, 'dilatation': 1, 'kernel_stride_pool': 3, 'activation_function_conv': 'relu', 'use_dropout_conv': False, 'use_normalization_conv': True, 'num_fc_layers': 1, 'fc_units_0': 64, 'activation_function_fc': 'leaky_relu', 'use_dropout_fc': True, 'dropout_rate_fc': 0.4, 'use_normalization_fc': True, 'batch_size': 32, 'learning_rate': 0.008393155642240618, 'optimizer': 'rmsprop', 'use_weight_decay': False}.[0m

Unsupported operator aten::leaky_relu encountered 3 time(s)

Unsupported operator aten::max_pool2d encountered 3 time(s)

Unsupported operator aten::tanh encountered 1 time(s)

[32m[I 2026-06-04 17:53:09,276][0m Trial 28 finished with values: [0.9415803931679619, 711270576.0] and parameters: {'num_conv_layers': 3, 'out_channels_layer_0': 32, 'out_channels_layer_1': 64, 'out_channels_layer_2': 8, 'kernel_size': 3, 'stride_conv': 1, 'padding_conv': 4, 'dilatation': 3, 'kernel_stride_pool': 4, 'activation_function_conv': 'leaky_relu', 'use_dropout_conv': False, 'use_normalization_conv': True, 'num_fc_layers': 1, 'fc_units_0': 16, 'activation_function_fc': 'tanh', 'use_dropout_fc': False, 'use_normalization_fc': False, 'batch_size': 16, 'learning_rate': 0.001950879991450779, 'optimizer': 'sgd', 'use_weight_decay': False, 'use_momentum': True, 'momentum': 0.512258852678246, 'use_nesterov': False}.[0m

  → Modelo salvo: optuna_studies/models/trial_28_model.pth

Unsupported operator aten::leaky_relu encountered 3 time(s)

Unsupported operator aten::max_pool2d encountered 3 time(s)

Unsupported operator aten::tanh encountered 1 time(s)

[32m[I 2026-06-04 19:32:24,131][0m Trial 29 finished with values: [0.923030100464938, 711270576.0] and parameters: {'num_conv_layers': 3, 'out_channels_layer_0': 32, 'out_channels_layer_1': 64, 'out_channels_layer_2': 8, 'kernel_size': 3, 'stride_conv': 1, 'padding_conv': 4, 'dilatation': 3, 'kernel_stride_pool': 4, 'activation_function_conv': 'leaky_relu', 'use_dropout_conv': False, 'use_normalization_conv': True, 'num_fc_layers': 1, 'fc_units_0': 16, 'activation_function_fc': 'tanh', 'use_dropout_fc': False, 'use_normalization_fc': False, 'batch_size': 16, 'learning_rate': 0.0021631632610418076, 'optimizer': 'sgd', 'use_weight_decay': False, 'use_momentum': False}.[0m

  → Modelo salvo: optuna_studies/models/trial_29_model.pth

Unsupported operator aten::leaky_relu encountered 6 time(s)

Unsupported operator aten::feature_dropout encountered 6 time(s)

Unsupported operator aten::max_pool2d encountered 6 time(s)

Unsupported operator aten::tanh encountered 1 time(s)

[32m[I 2026-06-04 20:18:14,064][0m Trial 30 finished with values: [0.09604863221884499, 688763568.0] and parameters: {'num_conv_layers': 6, 'out_channels_layer_0': 32, 'out_channels_layer_1': 64, 'out_channels_layer_2': 8, 'out_channels_layer_3': 64, 'out_channels_layer_4': 64, 'out_channels_layer_5': 16, 'kernel_size': 3, 'stride_conv': 1, 'padding_conv': 4, 'dilatation': 3, 'kernel_stride_pool': 4, 'activation_function_conv': 'leaky_relu', 'use_dropout_conv': True, 'dropout_rate_conv': 0.2, 'use_normalization_conv': False, 'num_fc_layers': 1, 'fc_units_0': 16, 'activation_function_fc': 'tanh', 'use_dropout_fc': False, 'use_normalization_fc': False, 'batch_size': 16, 'learning_rate': 0.002015176264780299, 'optimizer': 'sgd', 'use_weight_decay': True, 'weight_decay': 7.661143237954217e-05, 'use_momentum': False}.[0m

  → Modelo salvo: optuna_studies/models/trial_30_model.pth

Unsupported operator aten::leaky_relu encountered 3 time(s)

Unsupported operator aten::max_pool2d encountered 3 time(s)

[32m[I 2026-06-04 20:44:55,998][0m Trial 31 finished with values: [0.8806919630101632, 94285592.0] and parameters: {'num_conv_layers': 3, 'out_channels_layer_0': 32, 'out_channels_layer_1': 64, 'out_channels_layer_2': 8, 'kernel_size': 3, 'stride_conv': 2, 'padding_conv': 4, 'dilatation': 3, 'kernel_stride_pool': 5, 'activation_function_conv': 'leaky_relu', 'use_dropout_conv': False, 'use_normalization_conv': True, 'num_fc_layers': 1, 'fc_units_0': 8, 'activation_function_fc': 'relu', 'use_dropout_fc': True, 'dropout_rate_fc': 0.3, 'use_normalization_fc': True, 'batch_size': 32, 'learning_rate': 0.029331683337161792, 'optimizer': 'sgd', 'use_weight_decay': False, 'use_momentum': False}.[0m

  → Modelo salvo: optuna_studies/models/trial_31_model.pth

Unsupported operator aten::leaky_relu encountered 3 time(s)

Unsupported operator aten::max_pool2d encountered 3 time(s)

Unsupported operator aten::sigmoid encountered 1 time(s)

[32m[I 2026-06-04 21:11:37,209][0m Trial 32 finished with values: [0.839434436935151, 94285592.0] and parameters: {'num_conv_layers': 3, 'out_channels_layer_0': 32, 'out_channels_layer_1': 64, 'out_channels_layer_2': 8, 'kernel_size': 3, 'stride_conv': 2, 'padding_conv': 4, 'dilatation': 3, 'kernel_stride_pool': 5, 'activation_function_conv': 'leaky_relu', 'use_dropout_conv': False, 'use_normalization_conv': True, 'num_fc_layers': 1, 'fc_units_0': 8, 'activation_function_fc': 'sigmoid', 'use_dropout_fc': True, 'dropout_rate_fc': 0.6, 'use_normalization_fc': True, 'batch_size': 32, 'learning_rate': 0.07316673235890438, 'optimizer': 'sgd', 'use_weight_decay': False, 'use_momentum': True, 'momentum': 0.5365888719320426, 'use_nesterov': False}.[0m

[32m[I 2026-06-04 21:11:37,358][0m Trial 33 finished with values: [0.0, inf] and parameters: {'num_conv_layers': 4, 'out_channels_layer_0': 64, 'out_channels_layer_1': 16, 'out_channels_layer_2': 8, 'out_channels_layer_3': 128, 'kernel_size': 5, 'stride_conv': 1, 'padding_conv': 2, 'dilatation': 3, 'kernel_stride_pool': 5, 'activation_function_conv': 'tanh', 'use_dropout_conv': True, 'dropout_rate_conv': 0.3, 'use_normalization_conv': True, 'num_fc_layers': 1, 'fc_units_0': 16, 'activation_function_fc': 'relu', 'use_dropout_fc': False, 'use_normalization_fc': False, 'batch_size': 32, 'learning_rate': 0.0007646421302246395, 'optimizer': 'sgd', 'use_weight_decay': True, 'weight_decay': 4.331228659272617e-06}.[0m

  → Modelo salvo: optuna_studies/models/trial_32_model.pth

Unsupported operator aten::tanh encountered 3 time(s)

Unsupported operator aten::max_pool2d encountered 3 time(s)

Unsupported operator aten::sigmoid encountered 1 time(s)

[32m[I 2026-06-04 21:24:22,831][0m Trial 34 finished with values: [0.09978274874240992, 105019088.0] and parameters: {'num_conv_layers': 3, 'out_channels_layer_0': 32, 'out_channels_layer_1': 64, 'out_channels_layer_2': 64, 'kernel_size': 3, 'stride_conv': 2, 'padding_conv': 4, 'dilatation': 1, 'kernel_stride_pool': 4, 'activation_function_conv': 'tanh', 'use_dropout_conv': False, 'use_normalization_conv': False, 'num_fc_layers': 1, 'fc_units_0': 16, 'activation_function_fc': 'sigmoid', 'use_dropout_fc': True, 'dropout_rate_fc': 0.2, 'use_normalization_fc': True, 'batch_size': 32, 'learning_rate': 0.01658756348943779, 'optimizer': 'adam', 'use_weight_decay': False, 'use_betas': True, 'beta1': 0.9506274392436589, 'beta2': 0.9461561777214021}.[0m

  → Modelo salvo: optuna_studies/models/trial_34_model.pth

Unsupported operator aten::leaky_relu encountered 5 time(s)

Unsupported operator aten::max_pool2d encountered 4 time(s)

[32m[I 2026-06-04 23:12:02,751][0m Trial 35 finished with values: [0.7112765215961303, 1161820432.0] and parameters: {'num_conv_layers': 4, 'out_channels_layer_0': 8, 'out_channels_layer_1': 128, 'out_channels_layer_2': 16, 'out_channels_layer_3': 64, 'kernel_size': 3, 'stride_conv': 1, 'padding_conv': 0, 'dilatation': 3, 'kernel_stride_pool': 2, 'activation_function_conv': 'leaky_relu', 'use_dropout_conv': False, 'use_normalization_conv': True, 'num_fc_layers': 1, 'fc_units_0': 8, 'activation_function_fc': 'leaky_relu', 'use_dropout_fc': False, 'use_normalization_fc': False, 'batch_size': 32, 'learning_rate': 0.009674233691591122, 'optimizer': 'rmsprop', 'use_weight_decay': False, 'use_momentum': False}.[0m

  → Modelo salvo: optuna_studies/models/trial_35_model.pth

Unsupported operator aten::feature_dropout encountered 3 time(s)

Unsupported operator aten::max_pool2d encountered 3 time(s)

Unsupported operator aten::sigmoid encountered 1 time(s)

[32m[I 2026-06-05 00:22:25,103][0m Trial 36 finished with values: [0.4742242877853033, 169520200.0] and parameters: {'num_conv_layers': 3, 'out_channels_layer_0': 64, 'out_channels_layer_1': 32, 'out_channels_layer_2': 8, 'kernel_size': 3, 'stride_conv': 2, 'padding_conv': 1, 'dilatation': 1, 'kernel_stride_pool': 5, 'activation_function_conv': 'relu', 'use_dropout_conv': True, 'dropout_rate_conv': 0.6, 'use_normalization_conv': True, 'num_fc_layers': 1, 'fc_units_0': 8, 'activation_function_fc': 'sigmoid', 'use_dropout_fc': True, 'dropout_rate_fc': 0.4, 'use_normalization_fc': True, 'batch_size': 16, 'learning_rate': 0.019348864826060568, 'optimizer': 'sgd', 'use_weight_decay': True, 'weight_decay': 6.258923079330692e-05, 'use_momentum': False}.[0m

[32m[I 2026-06-05 00:22:25,275][0m Trial 37 finished with values: [0.0, inf] and parameters: {'num_conv_layers': 5, 'out_channels_layer_0': 16, 'out_channels_layer_1': 64, 'out_channels_layer_2': 8, 'out_channels_layer_3': 128, 'out_channels_layer_4': 32, 'kernel_size': 5, 'stride_conv': 2, 'padding_conv': 4, 'dilatation': 2, 'kernel_stride_pool': 5, 'activation_function_conv': 'tanh', 'use_dropout_conv': False, 'use_normalization_conv': False, 'num_fc_layers': 1, 'fc_units_0': 32, 'activation_function_fc': 'tanh', 'use_dropout_fc': True, 'dropout_rate_fc': 0.4, 'use_normalization_fc': True, 'batch_size': 32, 'learning_rate': 0.005933868216265667, 'optimizer': 'sgd', 'use_weight_decay': False}.[0m

  → Modelo salvo: optuna_studies/models/trial_36_model.pth

[32m[I 2026-06-05 00:22:25,446][0m Trial 38 finished with values: [0.0, inf] and parameters: {'num_conv_layers': 6, 'out_channels_layer_0': 32, 'out_channels_layer_1': 8, 'out_channels_layer_2': 64, 'out_channels_layer_3': 16, 'out_channels_layer_4': 128, 'out_channels_layer_5': 32, 'kernel_size': 3, 'stride_conv': 1, 'padding_conv': 3, 'dilatation': 3, 'kernel_stride_pool': 3, 'activation_function_conv': 'leaky_relu', 'use_dropout_conv': False, 'use_normalization_conv': True, 'num_fc_layers': 3, 'fc_units_0': 256, 'fc_units_1': 16, 'fc_units_2': 64, 'activation_function_fc': 'sigmoid', 'use_dropout_fc': False, 'use_normalization_fc': True, 'batch_size': 32, 'learning_rate': 0.003161646166790438, 'optimizer': 'adam', 'use_weight_decay': True, 'weight_decay': 0.0008330356808699643}.[0m

[32m[I 2026-06-05 00:22:25,613][0m Trial 39 finished with values: [0.0, inf] and parameters: {'num_conv_layers': 8, 'out_channels_layer_0': 128, 'out_channels_layer_1': 64, 'out_channels_layer_2': 32, 'out_channels_layer_3': 32, 'out_channels_layer_4': 8, 'out_channels_layer_5': 64, 'out_channels_layer_6': 16, 'out_channels_layer_7': 16, 'kernel_size': 4, 'stride_conv': 2, 'padding_conv': 2, 'dilatation': 1, 'kernel_stride_pool': 2, 'activation_function_conv': 'leaky_relu', 'use_dropout_conv': True, 'dropout_rate_conv': 0.6, 'use_normalization_conv': True, 'num_fc_layers': 1, 'fc_units_0': 64, 'activation_function_fc': 'relu', 'use_dropout_fc': True, 'dropout_rate_fc': 0.6, 'use_normalization_fc': False, 'batch_size': 32, 'learning_rate': 0.00030410617004867746, 'optimizer': 'rmsprop', 'use_weight_decay': False}.[0m

[32m[I 2026-06-05 00:22:25,765][0m Trial 40 finished with values: [0.0, inf] and parameters: {'num_conv_layers': 5, 'out_channels_layer_0': 8, 'out_channels_layer_1': 128, 'out_channels_layer_2': 128, 'out_channels_layer_3': 16, 'out_channels_layer_4': 64, 'kernel_size': 4, 'stride_conv': 2, 'padding_conv': 4, 'dilatation': 3, 'kernel_stride_pool': 4, 'activation_function_conv': 'tanh', 'use_dropout_conv': False, 'use_normalization_conv': True, 'num_fc_layers': 2, 'fc_units_0': 16, 'fc_units_1': 256, 'activation_function_fc': 'sigmoid', 'use_dropout_fc': False, 'use_normalization_fc': True, 'batch_size': 16, 'learning_rate': 0.0005950004731986064, 'optimizer': 'sgd', 'use_weight_decay': False}.[0m

Unsupported operator aten::leaky_relu encountered 3 time(s)

Unsupported operator aten::max_pool2d encountered 3 time(s)

Unsupported operator aten::tanh encountered 1 time(s)

[32m[I 2026-06-05 01:58:57,864][0m Trial 41 finished with values: [0.9388465230700538, 711270576.0] and parameters: {'num_conv_layers': 3, 'out_channels_layer_0': 32, 'out_channels_layer_1': 64, 'out_channels_layer_2': 8, 'kernel_size': 3, 'stride_conv': 1, 'padding_conv': 4, 'dilatation': 3, 'kernel_stride_pool': 4, 'activation_function_conv': 'leaky_relu', 'use_dropout_conv': False, 'use_normalization_conv': True, 'num_fc_layers': 1, 'fc_units_0': 16, 'activation_function_fc': 'tanh', 'use_dropout_fc': False, 'use_normalization_fc': False, 'batch_size': 16, 'learning_rate': 0.0012070209733051184, 'optimizer': 'sgd', 'use_weight_decay': False, 'use_momentum': True, 'momentum': 0.5091653268360162, 'use_nesterov': False}.[0m

  → Modelo salvo: optuna_studies/models/trial_41_model.pth

Unsupported operator aten::leaky_relu encountered 3 time(s)

Unsupported operator aten::max_pool2d encountered 3 time(s)

Unsupported operator aten::tanh encountered 1 time(s)

