[32m[I 2026-06-05 02:20:26,611][0m Trial 42 finished with values: [0.8784577073694073, 88824792.0] and parameters: {'num_conv_layers': 3, 'out_channels_layer_0': 32, 'out_channels_layer_1': 64, 'out_channels_layer_2': 8, 'kernel_size': 3, 'stride_conv': 2, 'padding_conv': 4, 'dilatation': 3, 'kernel_stride_pool': 5, 'activation_function_conv': 'leaky_relu', 'use_dropout_conv': False, 'use_normalization_conv': False, 'num_fc_layers': 1, 'fc_units_0': 8, 'activation_function_fc': 'tanh', 'use_dropout_fc': True, 'dropout_rate_fc': 0.3, 'use_normalization_fc': True, 'batch_size': 32, 'learning_rate': 0.047515438125806005, 'optimizer': 'sgd', 'use_weight_decay': False, 'use_momentum': True, 'momentum': 0.5066252304648899, 'use_nesterov': False}.[0m

  → Modelo salvo: optuna_studies/models/trial_42_model.pth

Unsupported operator aten::leaky_relu encountered 3 time(s)

Unsupported operator aten::max_pool2d encountered 3 time(s)

Unsupported operator aten::tanh encountered 1 time(s)

[32m[I 2026-06-05 02:39:48,074][0m Trial 43 finished with values: [0.875758447270323, 44449304.0] and parameters: {'num_conv_layers': 3, 'out_channels_layer_0': 16, 'out_channels_layer_1': 64, 'out_channels_layer_2': 8, 'kernel_size': 3, 'stride_conv': 2, 'padding_conv': 4, 'dilatation': 3, 'kernel_stride_pool': 5, 'activation_function_conv': 'leaky_relu', 'use_dropout_conv': False, 'use_normalization_conv': False, 'num_fc_layers': 1, 'fc_units_0': 8, 'activation_function_fc': 'tanh', 'use_dropout_fc': True, 'dropout_rate_fc': 0.4, 'use_normalization_fc': False, 'batch_size': 32, 'learning_rate': 0.048595853063679466, 'optimizer': 'sgd', 'use_weight_decay': False, 'use_momentum': True, 'momentum': 0.5181649765691939, 'use_nesterov': False}.[0m

  → Modelo salvo: optuna_studies/models/trial_43_model.pth

Unsupported operator aten::leaky_relu encountered 3 time(s)

Unsupported operator aten::max_pool2d encountered 3 time(s)

Unsupported operator aten::tanh encountered 2 time(s)

[32m[I 2026-06-05 02:53:39,520][0m Trial 44 finished with values: [0.4729381686841882, 44449368.0] and parameters: {'num_conv_layers': 3, 'out_channels_layer_0': 16, 'out_channels_layer_1': 64, 'out_channels_layer_2': 8, 'kernel_size': 3, 'stride_conv': 2, 'padding_conv': 4, 'dilatation': 3, 'kernel_stride_pool': 5, 'activation_function_conv': 'leaky_relu', 'use_dropout_conv': False, 'use_normalization_conv': False, 'num_fc_layers': 2, 'fc_units_0': 8, 'fc_units_1': 8, 'activation_function_fc': 'tanh', 'use_dropout_fc': True, 'dropout_rate_fc': 0.4, 'use_normalization_fc': False, 'batch_size': 32, 'learning_rate': 0.05744209428690156, 'optimizer': 'sgd', 'use_weight_decay': False, 'use_momentum': True, 'momentum': 0.6761129973598634, 'use_nesterov': False}.[0m

[32m[I 2026-06-05 02:53:39,688][0m Trial 45 finished with values: [0.0, inf] and parameters: {'num_conv_layers': 4, 'out_channels_layer_0': 16, 'out_channels_layer_1': 16, 'out_channels_layer_2': 64, 'out_channels_layer_3': 8, 'kernel_size': 3, 'stride_conv': 2, 'padding_conv': 0, 'dilatation': 3, 'kernel_stride_pool': 5, 'activation_function_conv': 'leaky_relu', 'use_dropout_conv': False, 'use_normalization_conv': False, 'num_fc_layers': 1, 'fc_units_0': 8, 'activation_function_fc': 'tanh', 'use_dropout_fc': True, 'dropout_rate_fc': 0.4, 'use_normalization_fc': False, 'batch_size': 32, 'learning_rate': 0.03965968494918328, 'optimizer': 'sgd', 'use_weight_decay': False}.[0m

  → Modelo salvo: optuna_studies/models/trial_44_model.pth

[32m[I 2026-06-05 02:53:39,970][0m Trial 46 finished with values: [0.0, inf] and parameters: {'num_conv_layers': 4, 'out_channels_layer_0': 16, 'out_channels_layer_1': 64, 'out_channels_layer_2': 8, 'out_channels_layer_3': 32, 'kernel_size': 4, 'stride_conv': 2, 'padding_conv': 4, 'dilatation': 2, 'kernel_stride_pool': 5, 'activation_function_conv': 'relu', 'use_dropout_conv': False, 'use_normalization_conv': False, 'num_fc_layers': 2, 'fc_units_0': 8, 'fc_units_1': 32, 'activation_function_fc': 'leaky_relu', 'use_dropout_fc': True, 'dropout_rate_fc': 0.4, 'use_normalization_fc': False, 'batch_size': 32, 'learning_rate': 0.09691743064843247, 'optimizer': 'adam', 'use_weight_decay': False}.[0m

[32m[I 2026-06-05 02:53:40,320][0m Trial 47 finished with values: [0.0, inf] and parameters: {'num_conv_layers': 7, 'out_channels_layer_0': 8, 'out_channels_layer_1': 8, 'out_channels_layer_2': 16, 'out_channels_layer_3': 64, 'out_channels_layer_4': 8, 'out_channels_layer_5': 128, 'out_channels_layer_6': 128, 'kernel_size': 4, 'stride_conv': 2, 'padding_conv': 3, 'dilatation': 1, 'kernel_stride_pool': 5, 'activation_function_conv': 'leaky_relu', 'use_dropout_conv': False, 'use_normalization_conv': False, 'num_fc_layers': 1, 'fc_units_0': 64, 'activation_function_fc': 'sigmoid', 'use_dropout_fc': True, 'dropout_rate_fc': 0.3, 'use_normalization_fc': True, 'batch_size': 32, 'learning_rate': 0.17595247476422832, 'optimizer': 'sgd', 'use_weight_decay': True, 'weight_decay': 4.107883191230624e-06}.[0m

Unsupported operator aten::tanh encountered 6 time(s)

Unsupported operator aten::feature_dropout encountered 3 time(s)

Unsupported operator aten::max_pool2d encountered 3 time(s)

[32m[I 2026-06-05 03:48:07,738][0m Trial 48 finished with values: [0.8964753085532513, 95642464.0] and parameters: {'num_conv_layers': 3, 'out_channels_layer_0': 32, 'out_channels_layer_1': 32, 'out_channels_layer_2': 8, 'kernel_size': 3, 'stride_conv': 2, 'padding_conv': 1, 'dilatation': 3, 'kernel_stride_pool': 3, 'activation_function_conv': 'tanh', 'use_dropout_conv': True, 'dropout_rate_conv': 0.3, 'use_normalization_conv': True, 'num_fc_layers': 3, 'fc_units_0': 256, 'fc_units_1': 16, 'fc_units_2': 128, 'activation_function_fc': 'tanh', 'use_dropout_fc': True, 'dropout_rate_fc': 0.2, 'use_normalization_fc': True, 'batch_size': 32, 'learning_rate': 0.021538630193201118, 'optimizer': 'sgd', 'use_weight_decay': False, 'use_momentum': True, 'momentum': 0.6482279188548521, 'use_nesterov': False}.[0m

[32m[I 2026-06-05 03:48:07,886][0m Trial 49 finished with values: [0.0, inf] and parameters: {'num_conv_layers': 4, 'out_channels_layer_0': 64, 'out_channels_layer_1': 64, 'out_channels_layer_2': 32, 'out_channels_layer_3': 128, 'kernel_size': 4, 'stride_conv': 2, 'padding_conv': 4, 'dilatation': 3, 'kernel_stride_pool': 2, 'activation_function_conv': 'leaky_relu', 'use_dropout_conv': False, 'use_normalization_conv': True, 'num_fc_layers': 1, 'fc_units_0': 128, 'activation_function_fc': 'sigmoid', 'use_dropout_fc': False, 'use_normalization_fc': False, 'batch_size': 16, 'learning_rate': 0.09430623124075302, 'optimizer': 'rmsprop', 'use_weight_decay': False}.[0m

  → Modelo salvo: optuna_studies/models/trial_48_model.pth

Ending Cell 47-----------------------------------------
Executing Cell 48--------------------------------------
"\n# Célula de treinamento teste de uma cnn\ncnn_params = CNNParameters(\n    num_conv_layers=4,\n    stride_conv_layers=1,\n    input_channels=3,\n    out_channels_list=[16, 32, 64, 128],\n    use_pooling=True,\n    padding_conv_layer=1,\n    dilatation=1,\n    bias=True,\n    kernel_size=3,\n    kernel_stride=2,\n    kernel_padding=0,\n    kernel_dilatation=1,\n    activation_function_conv='relu',\n    fully_connected_layers_list=[64],\n    activation_function_fully_connected='relu',\n    dropout_rate_fully_connected=0.5,\n    dropout_rate_conv=0.3,\n    output_size_fully_connected=len(CLASSES_DO_PROJETO),\n    image_size_height=IMG_HEIGHT,\n    image_size_width=IMG_WIDTH,\n    use_normalization_cnn=True,\n    use_normalization_fc=True\n)\nmodel, train_dataloader, test_dataloader, val_dataloader = create_cnn_model_and_dataloaders(\n    cnn_params, train_reduced_dataset, testA_dataset, val_reduced_dataset, batch_size=64\n)\nmodel = model.to(device)\nloss_fn = nn.CrossEntropyLoss()\noptimizer = torch.optim.Adam(model.parameters(), lr=1e-3, weight_decay=1e-4)\nhistory_train_loss, history_val_loss, history_val_metric = train_model(\n    model,\n    train_dataloader,\n    val_dataloader,\n    loss_fn,\n    optimizer,\n    num_epochs=2000,\n    patience=10,\n    metric_fn=f1_score_macro,\n    device=device,\n    verbose=True\n)\n"
Ending Cell 48-----------------------------------------
Executing Cell 49--------------------------------------
Ending Cell 49-----------------------------------------
Executing Cell 50--------------------------------------
Ending Cell 50-----------------------------------------
